{
  "id": "iron_ore",
  "world_id": "wha_au",
  "name": "Iron Ore",
  "type": "material",
  "rarity": "common",
  "weight": 0.8,
  "value": 2,
  "description_prose": "A chunk of raw iron ore pried from exposed rock faces. Needs smelting before it can be used in smithing.",
  "binding": "unbound",
  "unique": false,
  "stats": null
}
